{
	"schema": 1,
	"id": "fibocom-l850-gl",
	"display_name": "Fibocom L850-GL",
	"match": {
		"manufacturer": ["Fibocom"],
		"models_exact": ["L850-GL"],
		"usb": [
			{"vid": "2cb7", "pid": "0007", "composition": "mbim"},
			{"vid": "8087", "pid": "095a", "composition": "ncm"}
		]
	},
	"management_backend": "intel-xmm",
	"bearer_backends": {
		"mbim": "mbim-basic-connect",
		"ncm": "intel-xmm-ncm"
	},
	"ports": {
		"mbim": {
			"at_primary": "02",
			"ignored": ["04"],
			"at_secondary": "06"
		},
		"ncm": {
			"at_primary": "00",
			"ignored": ["02"],
			"at_secondary": "04",
			"data_candidates": ["06", "08", "0a"],
			"data_selector": "hardware-required"
		}
	},
	"ncm": {
		"session_cid": 0
	},
	"capabilities": {
		"shadow_inventory": "supported",
		"mbim": "planned",
		"ncm": "hardware-validation-required",
		"esim": "mbim-only-planned",
		"band_lock": "planned",
		"cell_lock": "experimental-disabled",
		"sim_switch": "probe-required"
	}
}
